24/09/2025 08:54:22,ESCOLA ESTADUAL PRESIDENTE TANCREDO NEVES,Rua João Felipe De Oliveira Sn,8432450039,eetancredoneves@educar.rn.gov.br,@tancredooficil9444,Emmanuel Bezerra De Santana,Talita Cristina De Brito,Estadual,6º ao 9º ano do Ensino Fundamental;1º ao 3º ano do Ensino Médio,Matutino;Vespertino,Vila Flor,Porte IV,173,8,7,Não,Sim,Sim,Não,Não se aplica porque não ocorreu reforma/manutenção,Sim,Sim,Sim,Todas as salas de aula com ar condicionado,Monofásica,Não sei informar,Não,Não se aplica porque a Escola não possui quadra poliesportiva,Sim,Não,Não se aplica,Sim,Ginásio/Quadra municipal,Sim,Não,Não,Não,Não se aplica porque a Escola não possui laboratório de informática,Não se aplica porque a Escola não possui laboratório de informática,Não se aplica porque a Escola não possui laboratório de informática,Não se aplica porque a Escola não possui laboratório de informática,Sim,Sim,Regular,Sim,Não,Não,Sim,Não,Não,Sim,Sim,Todos Estão Em Perfeito Estado/Não Está Faltando Nada,Sim,Sim,Sim,1 lanche por turno,Não,Sim,Controle feito pelas merendeiras,Não,Armários;Mesas E Cadeiras De Refeitório;Lousa Para Sala De Aula;Produtos Tecnológicos Como Lousa Inteligente,Sim,Sim,Não,Não Se Aplica,Não,Não,Não,Sim,Não,Não,Sim,1,Sim,Não se aplica,Sim,Sim,Não se aplica porque a Escola já possui transporte escolar,8,Não,Nenhum,Não se aplica porque a Escola não possui alunos que necessitam do transporte escolar especial,Não se aplica,Sim,Não,Não se aplica porque não ha carência de professores na Escola,Sim,Não,Não,Sim,Não,Sim,Sim,Sim,"Porte da escola (pequeno, médio, grande porte)",Sim,Sim,Sim,Semestral,Sim,Sim,Sim,"Festa junina, dias dos pais, dia das mães, interclasse, feira de ciências, palestras, hallowen","3,1",.,não sei,Não,Sim,Sim,Completo,Sim,Sim,Completo,Não,Sim,Sim,Sim,Não,Não,Sim,Sim,Não,Sim,Não,pdde e pague,Sim,Não,Não,Não se aplica,Não,Não se aplica,Sim,Sim,Sim,Não,Não se aplica,Adquirir mais conhecimento,Sim,Recursos suficientes
24/09/2025 15:37:19,ESCOLA ESTADUAL PROFA. MARIA OCILA BEZERRIL,"Avenida Professor Genar Bezerril, 563 Pedro Velho/Rn.",(84) 3247-2462,mocilabezerril@hotmail.com,instagram: prof_mariaocila facebook: ocilabe bezerrilensino médio e ocila bezerrilerril,Jeane Carla Pinheiro,Adalberto Giliard Ferreira,Estadual,1º ao 3º ano do Ensino Médio;EJA,Noturno,Pedro Velho,Porte I,247,7,8,"Sim, apenas em parte dos turnos de funcionamento da Escola",Não,Sim,Sim,2025;2023,Sim,Sim,Sim,Parte das salas de aula com ar condicionado e outra parte com ventiladores,Trifásica,Sim,Sim,Não,Sim,Sim,"Futebol, futsal e futebol",Sim,Quadra/Pátio da escola,Sim,Não,Sim,Não,Não se aplica porque a Escola não possui laboratório de informática,Não se aplica porque a Escola não possui laboratório de informática,Não se aplica porque a Escola não possui laboratório de informática,Não se aplica porque a Escola não possui laboratório de informática,Sim,Sim,Regular,Não,Não se aplica porque a Escola não possui laboratório de ciências,Não se aplica porque a Escola não possui laboratório de ciências,Não se aplica porque a Escola não possui laboratório de ciências,Sim,Não,Não,Não,Freezer;Fogão;Microondas;Armário;Utensílios De Cozinha,Sim,Sim,Sim,1 lanche por turno,Sim,Sim,Verificação da qualidade e quantidade no momento do recebimento,Não,Kit Aluno;Conjunto Professor;Armários;Birôs;Mesas E Cadeiras De Refeitório,Não,Sim,Sim,Fazendo Busca Ativa Através De Ligação E Ou Visita A Família,Não,Sim,Não,Sim,"Sim, a Escola recebe livros com atraso",Não,Sim,3,Não,Psicólogo;Assistente Social,Sim,Não,Não se aplica porque a Escola já possui transporte escolar,142,Não,Nenhum,Não se aplica porque a Escola não possui alunos que necessitam do transporte escolar especial,0,Não,Sim,Efetivos,Sim,Não,Sim,Sim,Não,Não,Sim,Sim,A escola precisa obter um percentual de alunos e estar em dias com a prestação de contas para poder receber os recursos,Sim,Sim,Não,Não se aplica porque a Escola não promove reuniões com os pais/responsáveis,Não se aplica porque a Escola não promove reuniões com os pais/responsáveis,Não,Sim,"Gincanas, festas em datas comemorativas e mostra de cultura",Não se aplica,Não se aplica,8.5% de alunos reprovados,Não,Sim,Sim,Completo,Sim,Sim,Completo,Não,Sim,Sim,Sim,Não,Sim,Sim,Sim,Não,Sim,Não,"PDDE Ed. BÁSICA, PDDE QUALIDADE, PAGUE ORDINÁRIO, PAGUE PREDIAL, PAGUE MAIS ALIMENTAÇÃO, PAGUE LIVROS",Sim,Sim,Não,Não se aplica,Não,Não se aplica,Sim,Sim,Sim,Não,Não se aplica,"Desenvolver um trabalho voltado para melhoria do desempenho do aluno oferecendo um serviço de qualidade que possa preparar os alunos para a vida e para o desenvolvimento pessoal e social, ampliando as oportunidades de um futuro com êxito no seu desenvolvimento intelectual e na melhoria da qualidade de vida.e",Sim,"Preciso engajamento da equipe e comunidade escolar com o mesmo próposito, com metas definidas para obter os resultados desejados."
29/09/2025 04:57:29,ESCOLA MUNICIPAL BARTOLOMEU FAGUNDES,Rua Joao Antonio De Oliveira Fagundes,9916119746,bartolomeufagundes98@gmail.com,e.m.bartolomeu,Erinalva Cassiano De Araujo,Não Se Aplica,Municipal,1º ao 3º ano do Ensino Médio,Matutino;Vespertino,Vila Flor,Porte IV,106,06,03,"Sim, em todos os turnos de funcionamento da Escola",Sim,Não,Sim,2024,Sim,Sim,Sim,Todas as salas de aula com ar condicionado,Trifásica,Sim,Não,Não se aplica porque a Escola não possui quadra poliesportiva,Não,Não,Não se aplica,Sim,Quadra/Pátio da escola,Não,Sim,Sim,Não,Não se aplica porque a Escola não possui laboratório de informática,Não se aplica porque a Escola não possui laboratório de informática,Não se aplica porque a Escola não possui laboratório de informática,Não se aplica porque a Escola não possui laboratório de informática,Sim,Não,Regular,Não,Não se aplica porque a Escola não possui laboratório de ciências,Não se aplica porque a Escola não possui laboratório de ciências,Não se aplica porque a Escola não possui laboratório de ciências,Sim,Sim,Sim,Sim,Microondas;Armário,Sim,Não,Não se aplica porque a Escola não possui cardápio orientado por nutricionista,1 lanche por turno,Sim,Não,Não se aplica,Sim,Birôs;Cadeiras,Sim,Não,Não,Não Se Aplica,Não,Não,Sim,Não,"Sim, a Escola recebe livros com atraso",Não,Sim,13,Sim,Professor de educação especializada,Sim,Sim,Não se aplica porque a Escola já possui transporte escolar,04,Não,Não se aplica,Não se aplica porque a Escola não possui alunos que necessitam do transporte escolar especial,0,Sim,Não,Não se aplica porque não ha carência de professores na Escola,Sim,Sim,Não,Sim,Sim,Sim,Não,Não,Não se aplica,Não,Não,Sim,Bimestral,Sim,Sim,Sim,"Feiras culturais,apresentaçoes nas datas comemorativas","3,2",Não se aplica,0,Não se aplica,Não,Não se aplica porque a Escola não possui Conselho Escolar,Não se aplica porque a Escola não possui Conselho Escolar,Não,Não se aplica porque a Escola não possui Conselho de Classe,Não se aplica porque a Escola não possui Conselho de Classe,Não,Não,Sim,Sim,Não,Não,Sim,Não,Não,Não,Não,Não se aplica,Não,Não,Não,Não se aplica,Não,Não se aplica,Não,Não se aplica porque a equipe gestora não recebeu nenhuma capacitação sobre a prestação de contas,Não,Não,NAO SE AOLICA,Fazer o menhor para que aja um bom funcionamento e desempenho dos alunos e profissionais,Sim,Desenvolver encontros de familiares na escola para um bom relacionamento entre escola e familia
29/09/2025 08:32:36,ESCOLA MUNICIPAL MANOEL GERMANO DOS SANTOS,"Rua Astrogildo Freire, S/N",84 9 91243092,escolamages@yahoo.com.br,(facebook): manoel germano dos santos. (instagrama): escola_mages_bf,Sheila Duarte Da Silva Jerônimo,Zenilde Martins Do Nascimento,Municipal,6º ao 9º ano do Ensino Fundamental,Matutino;Vespertino,Baía Formosa,Porte IV,327,10,10,"Sim, em todos os turnos de funcionamento da Escola",Sim,Sim,Sim,2025,Sim,Sim,Sim,Todas as salas de aula com ar condicionado,Trifásica,Sim,Não,Não se aplica porque a Escola não possui quadra poliesportiva,Sim,Não,Não se aplica,Sim,"Quadra de esportes, ginásio de esportes, campo de futebol e praia",Não,Não se aplica porque a Escola não possui biblioteca/sala de leitura,Não se aplica porque a Escola não possui biblioteca/sala de leitura,Não,Não se aplica porque a Escola não possui laboratório de informática,Não se aplica porque a Escola não possui laboratório de informática,Não se aplica porque a Escola não possui laboratório de informática,Não se aplica porque a Escola não possui laboratório de informática,Sim,Não,Satisfatória,Não,Não se aplica porque a Escola não possui laboratório de ciências,Não se aplica porque a Escola não possui laboratório de ciências,Não se aplica porque a Escola não possui laboratório de ciências,Sim,Sim,Sim,Sim,Freezer,Sim,Sim,Sim,2 lanches e 1 almoço,Não,Sim,Controle supervisionado pela Secretaria Municipal de Educação,Sim,Não se aplica,Sim,Sim,Sim,Contato Com Os Responsáveis. Visitas Domiciliares. Encaminhamento Para O Setor De Busca Ativa E Uso Da Ficai Com Encaminhamento Ao Conselho Tutelar.,Sim,Não,Não,Sim,Não,Sim,Sim,32,Não,Professor de educação especializada;Mais profissionais para acompanhar os estudantes NEE,Sim,Sim,Não se aplica porque a Escola já possui transporte escolar,0,Não,0,Não se aplica porque a Escola não possui alunos que necessitam do transporte escolar especial,0,Não se aplica porque a Escola não possui alunos que necessitam do transporte escolar especial,Não,Não se aplica porque não ha carência de professores na Escola,Sim,Sim,Sim,Sim,Sim,Sim,Sim,Sim,Quantidade de alunos,Sim,Sim,Sim,Bimestral,Sim,Sim,Sim,Feiras culturais,"4,1",Não se aplica,"18,2%",Não,Sim,Sim,Completo,Sim,Sim,Completo,Não,Não,Sim,Sim,Não,Não,Sim,Sim,Sim,Sim,Não,A escola recebe diretamente recursos anuais através do Programa Dinheiro Direto na Escola para custeio e capital de acordo com o número de alunos e recursos da Educação Conectada.,Sim,Sim,Não,Não se aplica,Sim,Não se aplica,Sim,Sim,Não,Sim,"A escola está vivendo a experiência do Regime Integral, o que em sido bem desafiador.","Buscar aproximar mais a escola da comunidade através de parcerias que visem essa aproximação. trabalhar a questão do comportamento/indisciplina dos estudantes, conscientizando-os acerca da responsabilidade de cada um na sua própria aprendizagem, no respeito ao próximo e conservação do espaço escolar e patrimônio.",Não,Não se aplica
29/09/2025 08:40:21,ESCOLA MUNICIPAL ELZA BEZERRIL RIBEIRO,Rua Olívia De Souza,84981558615,aleribeirosilva@outlook.com,@elzaemfoco,Maria Das Neves Soares Do Nascimento,Sonia Ferreira Martins,Municipal,1º ao 5º ano do Ensino Fundamental;6º ao 9º ano do Ensino Fundamental;EJA,Matutino;Vespertino;Noturno,Canguaretama,Porte III,472,22,9,"Sim, em todos os turnos de funcionamento da Escola",Não,Sim,Sim,2024,Sim,Sim,Sim,Todas as salas de aula com ar condicionado,Monofásica,Não,Sim,Sim,Sim,Sim,"Futebol masculino e feminino, karatê",Sim,Quadra/Pátio da escola,Sim,Sim,Sim,Não,Não se aplica porque a Escola não possui laboratório de informática,Não se aplica porque a Escola não possui laboratório de informática,Não se aplica porque a Escola não possui laboratório de informática,Não se aplica porque a Escola não possui laboratório de informática,Sim,Não,Satisfatória,Sim,Não,Não,Não,Sim,Sim,Sim,Sim,Todos Estão Em Perfeito Estado/Não Está Faltando Nada,Sim,Sim,Sim,1 lanche por turno,Sim,Sim,Controle supervisionado pela Secretaria Municipal de Educação,Sim,Não se aplica,Sim,Sim,Sim,Ações Do Busca Ativa Escolar E Personalização Do Currículo,Não,Sim,Sim,Sim,Não,Não,Sim,32,Sim,os profissionais são suficientes,Sim,Sim,Não se aplica porque a Escola já possui transporte escolar,40,Sim,4,Todos os alunos nessa situação são atendidos,0,Sim,Sim,Efetivos,Sim,Não,Não,Sim,Sim,Sim,Não,Sim,Quantidade de alunos,Sim,Sim,Sim,Bimestral,Não,Sim,Sim,"Gincanas, arraia, mostra de ciências, arte e cultura","Anos iniciais 4,2 e anos finais 3,7",Não se aplica,9%,Não,Sim,Sim,Completo,Sim,Sim,Completo,Sim,Sim,Sim,Sim,Não,Sim,Sim,Sim,Sim,Sim,Sim,"Recursos advindos dos pogramas federais, PDDE e outros.",Sim,Sim,Não,Não se aplica,Não,Não se aplica,Sim,Sim,Sim,Sim,"O Atendimento Educacional Especializado, Construção e adaptação curricular, Robótica Educacional e combate a desigualdade de aprendizagem.",Colaborar no desenvolvimento escolar de modo a cumprir a missão da escola como agente de transformação social e acadêmica.,Não,Não se aplica
01/10/2025 11:10:00,ESCOLA MUNICIPAL DE 1º GRAU DR. JOSÉ TARGINO,Rua Genar Bezerril - Nº 484 - Centro - Pedro Velho/Rn,(84) 9 8144-3231,jtarginopv@gmail.com,@jtarginopv1 - instagram,Mariana Dino Do Nascimento,Raquel Silva Marinho Pereira,Municipal,6º ao 9º ano do Ensino Fundamental,Matutino;Vespertino;Noturno,Pedro Velho,Porte V,706,20,9,"Sim, apenas em parte dos turnos de funcionamento da Escola",Sim,Sim,Sim,2024,Sim,Sim,Sim,Todas as salas de aula com ar condicionado,Trifásica,Sim,Não,Não se aplica porque a Escola não possui quadra poliesportiva,Sim,Sim,"Futsal, futvôlei, handbol, basquete e futebol e futebol de areia",Sim,"No pátio da escola, nos espaços cedidos pela prefeitura (ginásio brasileirão, campo de areia e campo de futebol da cidade)",Sim,Sim,Sim,Não,Não se aplica porque a Escola não possui laboratório de informática,Não se aplica porque a Escola não possui laboratório de informática,Não se aplica porque a Escola não possui laboratório de informática,Não se aplica porque a Escola não possui laboratório de informática,Sim,Não,Regular,Não,Não se aplica porque a Escola não possui laboratório de ciências,Não se aplica porque a Escola não possui laboratório de ciências,Não se aplica porque a Escola não possui laboratório de ciências,Não,Não se aplica porque a Escola não possui refeitório,Sim,Sim,Processador/Multiprocessador,Sim,Sim,Sim,Mais de 3 refeições,Sim,Sim,Controle realizado em planilhas (entrada e saída de produtos),Sim,Mesas E Cadeiras De Refeitório,Sim,Não,Sim,Busca Ativa E Encaminhamento Ao Conselho Tutelar.,Não,Sim,Sim,Sim,Não,Não,Sim,32,Não,Professor de educação especializada;Professor da Sala de Recursos Multifuncionais (SRM);Profissional de Apoio (Cuidador);Psicólogo;Assistente Social,Sim,Sim,Não se aplica porque a Escola já possui transporte escolar,188,Sim,2,Todos os alunos nessa situação são atendidos,0,Não,Sim,Efetivos;Temporários,Sim,Sim,Sim,Sim,Sim,Sim,Sim,Sim,Quantidade de alunos,Sim,Sim,Sim,Bimestral,Sim,Sim,Sim,"Gincana estudantil, feira de ciências, festa junina, trilhas ecológicas, aulas de campo e interclasses.",Não se aplica,Não se aplica,"26,3%",Não,Sim,Sim,Completo,Sim,Sim,Completo,Não,Não,Sim,Sim,Não,Sim,Sim,Não,Sim,Sim,Não,PDDE,Sim,Sim,Não,Não se aplica,Não,Não se aplica,Sim,Sim,Sim,Não,Não se aplica,"Busca melhorias para a comunidade escolar, proporcionando uma educação de qualidade e emancipadora",Sim,Recursos financeiros e humano; formações continuadas e ampliação de espaços para realização dos projetos.
02/10/2025 04:06:34,ESCOLA MUNICIPAL DE ENSINO FUNDAMENTAL SÃO SEBASTIÃO,"Rua São Sebastiã, 173 - Cuité/Pedro Velho/Rn",(84)981167414,escolamcbranco@gmail.com,escolam.saosebastiao,Alciene Félix Da Silva,Não Se Aplica,Municipal,1º ao 5º ano do Ensino Fundamental;6º ao 9º ano do Ensino Fundamental;EJA,Matutino;Vespertino;Noturno,Pedro Velho,Porte III,320,15,7,Não,Sim,Sim,Sim,2025;2024,Sim,Sim,Sim,Todas as salas de aula com ventiladores,Monofásica,Não,Não,Não se aplica porque a Escola não possui quadra poliesportiva,Sim,Não,Não se aplica,Sim,Locais emprestados,Não,Não se aplica porque a Escola não possui biblioteca/sala de leitura,Sim,Não,Não se aplica porque a Escola não possui laboratório de informática,Não se aplica porque a Escola não possui laboratório de informática,Não se aplica porque a Escola não possui laboratório de informática,Não se aplica porque a Escola não possui laboratório de informática,Sim,Não,Regular,Não,Não se aplica porque a Escola não possui laboratório de ciências,Não se aplica porque a Escola não possui laboratório de ciências,Sim,Não,Não se aplica porque a Escola não possui refeitório,Sim,Sim,"Freezer;Geladeira;Fogão;Armário;Utensílios De Cozinha;Torradeira, Liquidificador",Sim,Sim,Não,1 lanche por turno,Não,Sim,Controle feito manualmente em caderno ou ficha de controle,Não,Armários;Birôs;Mesas,Não,Sim,Não,Não Se Aplica,Sim,Não,Não,Sim,"Sim, a Escola recebe livros com atraso",Não,Sim,15,Não,Professor de educação especializada;Professor da Sala de Recursos Multifuncionais (SRM);Profissional de Apoio (Cuidador);Psicólogo;Assistente Social;,Sim,Sim,Não,120,Sim,4,Todos os alunos nessa situação são atendidos,0,Não,Sim,Efetivos,Sim,Não,Não,Não,Sim,Sim,Não,Não,Não se aplica,Não,Não,Sim,Bimestral,Sim,Sim,Sim,"Semana de cultura, datas comemorativas, jogos internos, jogos externos, gincanas",Não se aplica,Não se aplica,"6,58%",Não,Sim,Sim,Completo,Não,Não se aplica porque a Escola não possui Conselho de Classe,Não se aplica porque a Escola não possui Conselho de Classe,Não,Não,Sim,Sim,Não,Não,Sim,Não,Não,Sim,Não,PDDE,Sim,Sim,Não,Não se aplica,Não,Não se aplica,Não,Não se aplica porque a equipe gestora não recebeu nenhuma capacitação sobre a prestação de contas,Sim,Não,Não se aplica,"Gerir da melhor forma possível, visando o bem estar de todos e uma aprendizagem significativa",Sim,Recursos humanos e materiais
09/10/2025 04:49:41,ESCOLA MUNICIPAL JUAREZ RABELO,"Rua Marecha Deodoro, Nº Sn",84 994614613,betobarbalhocantor@gmail.com,emjuarezrabelo (instagran) e.m.juarez rabelo,Eriberto Da Silva Bezerra,Nelcylene Pontes De Moura,Municipal,1º ao 5º ano do Ensino Fundamental;6º ao 9º ano do Ensino Fundamental,Matutino;Vespertino,Canguaretama,Porte IV,1120,35,13 (sede) 06(anexo),"Sim, em todos os turnos de funcionamento da Escola",Não,Sim,Sim,2025;2023,Sim,Sim,Sim,Todas as salas de aula com ar condicionado,Trifásica,Sim,Não,Não se aplica porque a Escola não possui quadra poliesportiva,Sim,Não,Não se aplica,Sim,Ginásio/Quadra municipal,Sim,Sim,Sim,Não,Não se aplica porque a Escola não possui laboratório de informática,Não se aplica porque a Escola não possui laboratório de informática,Não se aplica porque a Escola não possui laboratório de informática,Não se aplica porque a Escola não possui laboratório de informática,Não,Não,Regular,Sim,Não,Não,Sim,Não,Não se aplica porque a Escola não possui refeitório,Sim,Não,Armário;Utensílios De Cozinha,Sim,Sim,Sim,1 lanche por turno,Sim,Sim,Recebi-se semanamente e é armazenodo na escola,Não,Armários;Birôs;Cadeiras;Mesas,Sim,Sim,Sim,"Entramos Em Contato Com As Famílias, Quando Não Coseguimos Encaminhamos Para O Busca Ativa.",Não,Não,Não,Sim,"Sim, a Escola recebe menos livros que a quantidade de alunos",Não,Sim,68,Sim,Psicólogo,Sim,Sim,Não se aplica porque a Escola já possui transporte escolar,850,Sim,2 alunos,Todos os alunos nessa situação são atendidos,Não se aplica,Sim,Não,Não se aplica porque não ha carência de professores na Escola,Não,Não,Sim,Sim,Sim,Sim,Sim,Sim,Quantidade de alunos,Sim,Sim,Sim,Semestral,Sim,Sim,Sim,"Interclasse, gincana, feira de ciência","Ano iniciais 4,5 anos finais 3,5 (ultima avaliação)","Sala avaliador os alunos do 2º ano:60% estão em em nivel básico e, apenas 5% estão em nível avançado.","24,91%",Não,Sim,Sim,Completo,Sim,Sim,Completo,Não,Sim,Sim,Sim,Não,Sim,Sim,Sim,Sim,Sim,Não,"PDDE BÁSICO, EDUCAÇÃO CONECTADA, ESCOLA DA ADOLESCENCIA.",Sim,Sim,Não,Não se aplica,Não,Não se aplica,Sim,Sim,Sim,Sim,"Foi implantado o projeto Andromida pela secretaria de educação, com aulas extras de música, dança e robótica.","Buscar uma educação de qualidade para nossos discentes, possibilitando um bom trabalho de equipe em prol de um melhor resultado.",Sim,Alguns ajustes finas e o recebimento do recurso escola da adolescencia para aquisição de materiais.
10/10/2025 09:39:21,CENTRO EDUCACIONAL RURAL ROBERTO MAGALHÃES DE MELO,Avenida Gilberto Rodrigues S/N,84996222350,magalhaesroberto780@gmail.com,robertomagalhaes,Joao Alves Galvão Neto,Joelma Freire De Andrade,Municipal,1º ao 5º ano do Ensino Fundamental;6º ao 9º ano do Ensino Fundamental,Matutino;Vespertino,Canguaretama,Porte IV,415,22,11,"Sim, em todos os turnos de funcionamento da Escola",Sim,Sim,Sim,2023,Não,Sim,Sim,Todas as salas de aula com ar condicionado,Trifásica,Sim,Não,Não se aplica porque a Escola não possui quadra poliesportiva,Sim,Sim,Futebol e volei,Sim,Ginásio/Quadra municipal,Sim,Sim,Sim,Não,Não se aplica porque a Escola não possui laboratório de informática,Não se aplica porque a Escola não possui laboratório de informática,Não se aplica porque a Escola não possui laboratório de informática,Não se aplica porque a Escola não possui laboratório de informática,Sim,Não,Regular,Sim,Não,Sim,Sim,Sim,Sim,Sim,Sim,Microondas;Armário,Sim,Sim,Sim,1 lanche por turno,Sim,Sim,Controle realizado em planilhas (entrada e saída de produtos),Sim,Armários;Mesas,Sim,Sim,Não,"Reuniao Com A Famila, Busca Ativa Desntre Outros.",Sim,Sim,Sim,Sim,Não,Não,Sim,32,Sim,Psicólogo,Sim,Sim,Não se aplica porque a Escola já possui transporte escolar,150,Sim,25,Todos os alunos nessa situação são atendidos,0,Não,Não,Não se aplica porque não ha carência de professores na Escola,Sim,Sim,Sim,Sim,Sim,Sim,Não,Sim,"Porte da escola (pequeno, médio, grande porte)",Sim,Sim,Sim,Semanal,Sim,Sim,Sim,"Dia da familia na escola, gincana, feira de ciencia, são joao dentre outras atividades",4.6,6.0,"0,5%",Nao,Sim,Sim,Completo,Não,Não se aplica porque a Escola não possui Conselho de Classe,Não se aplica porque a Escola não possui Conselho de Classe,Não,Sim,Sim,Sim,Não,Sim,Sim,Não,Sim,Sim,Não,"PDDE BASICO E INTERATIVO, INTERNET CONECTADA, FAMILIA NA ESCOLA",Sim,Sim,Não,Não se aplica,Não,Não se aplica,Sim,Sim,Sim,Não,Não se aplica,"Garantir que o ensino siga o curriculo e as metas educacionais, apoiar e orientar os professore para melhorarem suas praticas pedagogicas e incetivar ptojetor que melhorem o aprendizagem do aluno.",Sim,"Projeto de melhoria da educação por meio da gestao escolar eficiente, ja que o gestor e responsavel por articular os diferentes setores da escola: pedagogico, administrativo e comunitario."
13/10/2025 02:40:29,ESCOLA MUNICIPAL JOÃO ANACLETO FILHO,Largo Acelino Gomes Da Cruz,84-32442140,escolajafbfsecretaria@gmail.com,escolajafbf,Adriana Câmara De Brito,Claudianeide Do Nascimento Guerra,Municipal,1º ao 5º ano do Ensino Fundamental,Matutino;Vespertino,Baía Formosa,Porte II,248,10,7,"Sim, em todos os turnos de funcionamento da Escola",Sim,Não,Sim,2025,Sim,Sim,Sim,Todas as salas de aula com ar condicionado,Trifásica,Sim,Não,Não se aplica porque a Escola não possui quadra poliesportiva,Sim,Sim,"Futebol, voleibol, surf.",Sim,Pátio da escola e espaço da praça de eventos.,Não,Não se aplica porque a Escola não possui biblioteca/sala de leitura,Sim,Sim,21 a 30,Não se aplica porque a Escola não possui laboratório de informática,Sim,Aulas e demais projetos pedagógicos realizados pelos professores com os alunos,Sim,Não,Satisfatória,Não,Não se aplica porque a Escola não possui laboratório de ciências,Não se aplica porque a Escola não possui laboratório de ciências,Sim,Sim,Sim,Sim,Sim,Fogão,Sim,Sim,Sim,2 lanches e 1 almoço,Sim,Sim,Sim. o registro é realizado diarimente no diário de alimentação escolar.,Sim,Lousa Para Sala De Aula,Sim,Não,Sim,"A Escola Realiza A Busca Ativa Do Aluno, Não Tendo Retorno A Escola, Aciona O Conselho Tutelar E A Rede De Proteção.",Não,Não,Não,Sim,Não,Sim,Sim,35,Sim,A escola já possui acompanhante para os alunos NEE com laudo.,Sim,Sim,Sim,3,Não,0,Não se aplica porque a Escola não possui alunos que necessitam do transporte escolar especial,0,Sim,Não,Não se aplica porque não ha carência de professores na Escola,Sim,Sim,Sim,Sim,Sim,Sim,Sim,Sim,Quantidade de alunos,Sim,Sim,Sim,Bimestral,Sim,Não,Sim,Apresentações culturais e sarau poétio.,4.8,Não se aplica,"4,7%",Sim,Sim,Sim,Completo,Sim,Sim,Completo,Não,Sim,Sim,Sim,Não,Não,Sim,Sim,Não,Sim,Não,"PDDE básico, PDDE qualidade.",Sim,Sim,Não,Não se aplica,Sim,"2024, pdde básico e qualidade",Sim,Não,Sim,Sim,"O SARAU POÉTICO é um projeto de literatura voltado para o desenvolvimento de habilidades de apreciação, leitura e escrita literária, como também conhecimento de obras e autores da literatura mundial, brasileira e local.","Conduzir a administração da instituição de ensino de maneira democrática, englobando as esferas pedagógica, administrativa e financeira, visando assegurar a qualidade do ensino, o adequado funcionamento da escola e a promoção de um ambiente educativo que seja seguro, colaborativo e inclusivo para todos os estudantes, visando a equidadde.",Não,Não se aplica
