14/10/2025 05:48:08,ESCOLA ESTADUAL MATIAS MACIEL,"Rua José Benedito Ferreira, S/N, Barra Do Cunhaú, Canguaretama/Rn.",84 3241-4303,eematiasmaciel@educar.rn.gov.br,eematiasmaciel,Solaneide Da Silva Andrade,Não Se Aplica,Estadual,6º ao 9º ano do Ensino Fundamental;1º ao 3º ano do Ensino Médio;EJA,Matutino;Vespertino;Noturno,Canguaretama,Porte V,95,5,3,"Sim, apenas em parte dos turnos de funcionamento da Escola",Sim,Sim,Sim,2023,Não,Sim,Sim,Todas as salas de aula com ventiladores,Monofásica,Sim,Não,Não se aplica porque a Escola não possui quadra poliesportiva,Não,Não,Não se aplica,Sim,"Espaços cedidos (campo de areia, campo de futebol, entre outros)",Não,Não se aplica porque a Escola não possui biblioteca/sala de leitura,Não se aplica porque a Escola não possui biblioteca/sala de leitura,Não,Não se aplica porque a Escola não possui laboratório de informática,Não se aplica porque a Escola não possui laboratório de informática,Não se aplica porque a Escola não possui laboratório de informática,Não se aplica porque a Escola não possui laboratório de informática,Sim,Sim,Satisfatória,Não,Não se aplica porque a Escola não possui laboratório de ciências,Não se aplica porque a Escola não possui laboratório de ciências,Não se aplica porque a Escola não possui laboratório de ciências,Sim,Não,Sim,Sim,Todos Estão Em Perfeito Estado/Não Está Faltando Nada,Sim,Sim,Sim,1 lanche por turno,Não,Não,Não se aplica,Não,Mesas E Cadeiras De Refeitório,Sim,Não,Sim,Contato Com Pais Ou Responsáveis,Não,Não,Não,Sim,"Sim, a Escola recebe menos livros que a quantidade de alunos",Não,Sim,6,Sim,Não se aplica,Sim,Sim,Não se aplica porque a Escola já possui transporte escolar,1,Sim,5,Todos os alunos nessa situação são atendidos,0,Sim,Sim,Efetivos,Sim,Não,Sim,Não,Não,Sim,Sim,Não,Não se aplica,Sim,Sim,Sim,Bimestral,Não,Sim,Não,Não se aplica,2023 anos finais: ideb 4.3,Simais formativa 2024 (3ª série do ens. médio) - língua portuguesa: 242 pontos e matemática: 246 pontos.,0%,Não,Sim,Sim,Completo,Sim,Sim,Completo,Não,Sim,Sim,Sim,Não,Não,Sim,Não,Não,Sim,Não,"PDDE, PAGUE e PNAE.",Sim,Sim,Não,Não se aplica,Não,Não se aplica,Sim,Não,Sim,Não,Não se aplica,Melhorar os índices de aprendizagem e aplicar o recursos adequadamente seguindo os princípios da gestão democrática.,Não,Não se aplica
17/10/2025 05:28:55,ESCOLA ESTADUAL EM TEMPO INTEGRAL FELIPE FERREIRA,"Rua Osório Chaves, Sn - Piquiri - Canguaretama/Rn",8432417090,eefelipeferreira@educar.rn.gov.br,@eefelipeferreira,Flavia Lino Duarte,Maria Gilza Ribeiro Da Cruz Lima,Estadual,1º ao 3º ano do Ensino Médio,Matutino;Vespertino;Noturno,Canguaretama,Porte II,211,6,4,"Sim, apenas em parte dos turnos de funcionamento da Escola",Não,Sim,Não,Não se aplica porque não ocorreu reforma/manutenção,Não,Não,Sim,Todas as salas de aula com ar condicionado,Trifásica,Não,Não,Não se aplica porque a Escola não possui quadra poliesportiva,Sim,Não,Não se aplica,Sim,Quadra/Pátio da escola,Não,Não se aplica porque a Escola não possui biblioteca/sala de leitura,Não se aplica porque a Escola não possui biblioteca/sala de leitura,Não,Não se aplica porque a Escola não possui laboratório de informática,Não se aplica porque a Escola não possui laboratório de informática,Não se aplica porque a Escola não possui laboratório de informática,Não se aplica porque a Escola não possui laboratório de informática,Sim,Sim,Regular,Não,Não se aplica porque a Escola não possui laboratório de ciências,Não se aplica porque a Escola não possui laboratório de ciências,Não se aplica porque a Escola não possui laboratório de ciências,Não,Não se aplica porque a Escola não possui refeitório,Sim,Não,Utensílios De Cozinha;Liquidificador Industrial,Não,Sim,Sim,Mais de 3 refeições,Não,Sim,Controle realizado por cardápio e valores de insumos utilizados,Não,Kit Aluno;Conjunto Professor;Armários;Birôs;Lousa Para Sala De Aula,Não,Não,Não,Não Se Aplica,Não,Sim,Não,Sim,"Sim, a Escola recebe menos livros que a quantidade de alunos",Não,Sim,5,Não,Profissional de Apoio (Cuidador);Psicólogo,Sim,Sim,Não se aplica porque a Escola já possui transporte escolar,13,Não,Não se aplica,Não se aplica porque a Escola não possui alunos que necessitam do transporte escolar especial,Zero,Sim,Sim,Efetivos;Temporários,Sim,Sim,Sim,Sim,Não,Sim,Sim,Não,Não se aplica,Sim,Sim,Sim,Bimestral,Sim,Sim,Sim,"Festa junina, formatura e jogos escolares internos","3,8",250,5%,Não,Sim,Sim,Completo,Sim,Sim,Completo,Não,Sim,Sim,Não,Não,Não,Sim,Não,Não,Sim,Não,"PNAE, PAGUE E PDDE",Sim,Não,Não,Não se aplica,Não,Não se aplica,Sim,Não,Sim,Não,Não se aplica,"Realizar uma gestão comprometida na evolução profissional dos estudantes, fazendo o trabalho coletivamente com os demais membros da equipe gestora, com os professores (principalmente) e com o suporte da direc e da seec/rn.",Não,Não se aplica
22/10/2025 04:59:18,ESCOLA MUNICIPAL DR. MANOEL F. DE MELO,Rua Principal S/N Sagi,084 991949910,martasueli.2015@hotmail.com,"sim, doutor manoel francisco de melo",Marta Sueli Tomé Da Silva Costa,Não,Municipal,1º ao 5º ano do Ensino Fundamental,Matutino,Baía Formosa,Porte V,63,5,5,"Sim, em todos os turnos de funcionamento da Escola",Sim,Não,Sim,2024;2023,Sim,Sim,Sim,Todas as salas de aula com ar condicionado,Trifásica,Sim,Não,Não se aplica porque a Escola não possui quadra poliesportiva,Sim,Não,Não se aplica,Sim,Quadra/Pátio da escola,Não,Não se aplica porque a Escola não possui biblioteca/sala de leitura,Não se aplica porque a Escola não possui biblioteca/sala de leitura,Não,Não se aplica porque a Escola não possui laboratório de informática,Não se aplica porque a Escola não possui laboratório de informática,Não se aplica porque a Escola não possui laboratório de informática,Não se aplica porque a Escola não possui laboratório de informática,Sim,Sim,Satisfatória,Não,Não se aplica porque a Escola não possui laboratório de ciências,Não se aplica porque a Escola não possui laboratório de ciências,Não se aplica porque a Escola não possui laboratório de ciências,Sim,Sim,Sim,Sim,Utensílios De Cozinha,Sim,Sim,Sim,2 lanches e 1 almoço,Sim,Sim,Semanalmente,Não,Mesas,Sim,Sim,Não,Uso Da Ficai,Não,Não,Sim,Sim,"Sim, a Escola recebe menos livros que a quantidade de alunos",Sim,Sim,4,Sim,Quadro profissional completo,Não,Não se aplica porque a Escola não utiliza transporte escolar,Não,0,Não,0,Não se aplica porque a Escola não possui alunos que necessitam do transporte escolar especial,0,Não se aplica porque a Escola não possui alunos que necessitam do transporte escolar especial,Não,Não se aplica porque não ha carência de professores na Escola,Sim,Sim,Sim,Sim,Sim,Sim,Sim,Não,Não se aplica,Sim,Sim,Sim,Bimestral,Sim,Sim,Sim,"Feira cultural, feira da reciclagem e datas comemorativas",5.5,Não se aplica,Sem reprovação 2024,Não,Sim,Sim,Completo,Não,Não se aplica porque a Escola não possui Conselho de Classe,Não se aplica porque a Escola não possui Conselho de Classe,Não,Não,Sim,Sim,Não,Não,Sim,Sim,Não,Sim,Não,PDDE ( PROGRAMA DINEIRO DIRETO NA ESCOLA),Sim,Sim,Não,Não se aplica,Não,Não se aplica,Sim,Não,Sim,Não,Não se aplica,Que a escola seja a melhor possível para o alunado.,Sim,"Da alimentação, evitando os alimentos enlatados e embutidos."
27/10/2025 09:21:43,CRECHE MUNICIPAL DONA DAL,"Rua Cordeiro, Sn, Vila Flor",84991472372,mariahelenaoliveira5425@gmail.com,não se aplica,Maria Helena De Oliveira,Não Se Aplica,Municipal,Educação Infantil,Matutino;Vespertino,Vila Flor,Porte I,80,05,05,"Sim, apenas em parte dos turnos de funcionamento da Escola",Sim,Sim,Sim,2024;2022,Sim,Sim,Sim,Todas as salas de aula com ventiladores,Monofásica,Sim,Não,Não se aplica porque a Escola não possui quadra poliesportiva,Não,Não,Não se aplica,Não,Não se aplica,Sim,Sim,Sim,Não,Não se aplica porque a Escola não possui laboratório de informática,Não se aplica porque a Escola não possui laboratório de informática,Não se aplica porque a Escola não possui laboratório de informática,Não se aplica porque a Escola não possui laboratório de informática,Não,Não,Regular,Não,Não se aplica porque a Escola não possui laboratório de ciências,Não se aplica porque a Escola não possui laboratório de ciências,Não se aplica porque a Escola não possui laboratório de ciências,Sim,Não,Sim,Não,Geladeira;Fogão;Microondas;Armário;Torradeira;Batedeira;Exaustor;,Sim,Sim,Sim,2 lanches e 1 almoço,Sim,Sim,Controle feito manualmente em caderno ou ficha de controle;controle realizado por cardápio e valores de insumos utilizados,Sim,Produtos Tecnológicos (Como Lousa Digital Ou Projetor);Móveis Para Secretaria Ou Direção,Sim,Não,Não,Busca Ativa Escolar,Não,Não,Sim,Sim,Não,Sim,Sim,05,Não,Professor de educação especializada/AEE;Professor da Sala de Recursos Multifuncionais (SRM);Mediador(a) escolar,Sim,Sim,Não,0,Não,0,Todos os alunos nessa situação são atendidos,0,Sim,Não,Não se aplica porque não ha carência de professores na Escola,Sim,Sim,Sim,Sim,Sim,Sim,Sim,Não,Não se aplica,Não,Não,Sim,Trimestral,Sim,Sim,Sim,"Festas escolares (dia das mães, páscoa, festa junina, natal);gincanas culturais ou solidárias;mostras literárias / feiras do livro;projetos de leitura;apresentações artísticas (teatro, dança, música);semana da cultura ou das artes;atividades ambientais (trilhas, hortas, campanhas);aulas de campo;visitas pedagógicas",Não se aplica,Não se aplica,Não se aplica,Não,Sim,Sim,Completo,Não,Não se aplica porque a Escola não possui Conselho de Classe,Não se aplica porque a Escola não possui Conselho de Classe,Não,Não,Sim,Sim,Não,Não,Sim,Não,Não,Não,Não,PDDE Alimentação,Não,Sim,Não,Não se aplica,Não,Não se aplica,Não,Não se aplica porque a equipe gestora não recebeu nenhuma capacitação sobre a prestação de contas,Sim,Não,Não se aplica,"Garantir o bom funcionamento da escola promovendo um ambiente seguro, saudável e acolhedor para o desenvolvimento integral das crianças.",Não,Não se aplica
27/10/2025 10:09:44,ESCOLA ESTADUAL FABRÍCIO MARANHÃO,"Rua João Pessoa,110",(84) 32472459,eefabriciomaranhao@educar.rn.gov.br,instagran( e.e.fabriciomaranhao),Leila Costa De Lira Carneiro,Ana Nery De Lima Fernandes,Estadual,1º ao 5º ano do Ensino Fundamental,Matutino;Vespertino,Pedro Velho,Porte III,299,11,6,"Sim, em todos os turnos de funcionamento da Escola",Sim,Sim,Não,Não se aplica porque não ocorreu reforma/manutenção,Sim,Não,Sim,Todas as salas de aula com ventiladores,Trifásica,Não sei informar,Não,Não se aplica porque a Escola não possui quadra poliesportiva,Não,Não,Não se aplica,Sim,Em frente a escola,Sim,Sim,Sim,Não,Não se aplica porque a Escola não possui laboratório de informática,Não se aplica porque a Escola não possui laboratório de informática,Não se aplica porque a Escola não possui laboratório de informática,Não se aplica porque a Escola não possui laboratório de informática,Sim,Sim,Regular,Não,Não se aplica porque a Escola não possui laboratório de ciências,Não se aplica porque a Escola não possui laboratório de ciências,Não se aplica porque a Escola não possui laboratório de ciências,Não,Não se aplica porque a Escola não possui refeitório,Sim,Não,Microondas;Processador/Multiprocessador;Torradeira;Liquidificador;Batedeira;Exaustor;Mesa De Preparo;Prateleiras,Sim,Sim,Sim,1 lanche por turno,Não,Sim,Por orientação do órgão responsável (drae ou secretaria de educação);controle feito diariamente durante a preparação da merenda;controle feito pelas merendeiras,Não,"Conjunto Professor (Mesa, Cadeira E Armário);Armários;Birôs;Estantes Para Livros / Armários De Armazenamento Para Material Pedagógico;Produtos Tecnológicos (Como Lousa Digital Ou Projetor);Móveis Para Secretaria Ou Direção;Equipamentos Para Sala Dos Professores;Equipamentos Para Biblioteca",Não,Sim,Não,Não Se Aplica,Sim,Sim,Não,Sim,"Sim, a Escola recebe menos livros que a quantidade de alunos",Não,Sim,30,Não,Professor da Sala de Recursos Multifuncionais (SRM);Psicólogo(a);Fonoaudiólogo(a);Terapeuta Ocupacional,Sim,Sim,Não,49,Não,Não se aplica,Não se aplica porque a Escola não possui alunos que necessitam do transporte escolar especial,0,Sim,Não,Não se aplica porque não ha carência de professores na Escola,Sim,Não,Não,Sim,Sim,Sim,Sim,Sim,"Porte da escola (pequeno, médio, grande porte)",Sim,Sim,Sim,Bimestral,Sim,Sim,Sim,"Festas escolares (dia das mães, páscoa, festa junina, natal);feiras de ciências;projetos de leitura;aulas de campo",4.4,Não se aplica,7%,Não,Sim,Sim,Completo,Sim,Sim,Completo,Não,Sim,Sim,Sim,Não,Não,Sim,Sim,Não,Sim,Não,PDDE Básico;PDDE Interativo;Educação Conectada;PNAE;PAGUE,Sim,Sim,Não,Não se aplica,Não,Não se aplica,Sim,Sim,Sim,Não,Não se aplica,"Garantir o funcionamento eficiente da escola, liderando e gerenciando todos os aspectos da instituição, desempenhando um papel fundamental na formação dos alunos e no desenvolvimento escolar como um todo.",Não,Não se aplica
27/10/2025 13:52:37,ESCOLA ESTADUAL EM TEMPO INTEGRAL FABRÍCIO MARANHÃO,"Rua Doutor Pedro Velho, Sn, Centro, Canguaretama Rn, Cep 59190-000",42412727,eefmaranhao@educar.rn.gov.br,@fama,Francisco Alves Galvão Neto,Ana Maria Pereira De Paiva,Estadual,6º ao 9º ano do Ensino Fundamental;1º ao 3º ano do Ensino Médio;EJA,Matutino;Vespertino;Noturno,Canguaretama,Porte III,361,12,6,"Sim, em todos os turnos de funcionamento da Escola",Não,Sim,Não,Não se aplica porque não ocorreu reforma/manutenção,Não,Sim,Sim,Todas as salas de aula com ar condicionado,Trifásica,Não sei informar,Não,Não se aplica porque a Escola não possui quadra poliesportiva,Não,Não,Não se aplica,Não,Não se aplica,Sim,Não,Sim,Sim,1 a 10,Sim,Sim,Pesquisas por parte dos alunos,Sim,Não,Satisfatória,Não,Não se aplica porque a Escola não possui laboratório de ciências,Não se aplica porque a Escola não possui laboratório de ciências,Não se aplica porque a Escola não possui laboratório de ciências,Não,Não se aplica porque a Escola não possui refeitório,Sim,Sim,Freezer;Geladeira;Fogão;Armário;Utensílios De Cozinha;Liquidificador;Pia,Sim,Sim,Sim,Mais de 3 refeições,Não,Sim,Controle semanal realizado pelo gestor escolar,Não,"Kit Aluno (Cadeira, Mesa E Materiais);Armários;Birôs;Estantes Para Livros / Armários De Armazenamento Para Material Pedagógico;Produtos Tecnológicos (Como Lousa Digital Ou Projetor);Equipamentos Para Biblioteca",Não,Sim,Sim,Busca Ativa Escolar;Contato Com Pais Ou Responsáveis;Reuniões De Gestão Sobre Evasão;Monitoramento Pela Frequência Escolar,Não,Não,Não,Sim,Não,Não,Sim,20,Não,Professor de educação especializada/AEE;Psicólogo(a);Assistente Social;Fonoaudiólogo(a),Sim,Sim,Não se aplica porque a Escola já possui transporte escolar,234,Sim,Alunos que moram locais isolados e possuem necessidades educacionais especiais.,Todos os alunos nessa situação são atendidos,0,Sim,Sim,Efetivos;Temporários,Sim,Não,Sim,Sim,Não,Sim,Sim,Sim,"Porte da escola (pequeno, médio, grande porte)",Sim,Sim,Sim,Bimestral,Não,Não,Sim,"Festas escolares (dia das mães, páscoa, festa junina, natal);atividades esportivas (jogos, torneios, olimpíadas);gincanas culturais ou solidárias;feiras culturais;aulas de campo",Não se aplica,7,15,Não,Sim,Sim,Possui vacância,Sim,Sim,Completo,Não,Sim,Sim,Sim,Sim,Não,Sim,Não,Não,Sim,Não,PDDE Básico;PDDE Qualidade;PDDE Escola da Adolescência;Educação Conectada;PNAE;PAGUE,Sim,Sim,Sim,Os locais de recebimento das prestações de contas são distantes,Sim,2025,Sim,Sim,Não,Sim,Incentivo à produção literária e esportiva.,Dinamizar a educação na escola.,Sim,Jovens escritores e jovens atletas.
28/10/2025 03:43:41,ESCOLA ESTADUAL 4 DE MARÇO,Rua Joaquim Manoel 47,84994140076,ee4demarco@educar.rn.gov.br,@escolaestadual04de,Kessia Katiane Alves Pessoa,Lúcia Maria Soares Tavares,Estadual,6º ao 9º ano do Ensino Fundamental;1º ao 3º ano do Ensino Médio;EJA,Matutino;Vespertino;Noturno,Canguaretama,Porte III,390,12,4,"Sim, em todos os turnos de funcionamento da Escola",Não,Sim,Não,Não se aplica porque não ocorreu reforma/manutenção,Sim,Não,Não,"Não se aplica porque as salas não possuem ar condicionado, nem ventiladores",Monofásica,Não,Não,Não se aplica porque a Escola não possui quadra poliesportiva,Não,Sim,Futebol masculino;jiu-jitsu;capoeira,Sim,Locais emprestados,Não,Não se aplica porque a Escola não possui biblioteca/sala de leitura,Sim,Não,Não se aplica porque a Escola não possui laboratório de informática,Não se aplica porque a Escola não possui laboratório de informática,Não se aplica porque a Escola não possui laboratório de informática,Não se aplica porque a Escola não possui laboratório de informática,Sim,Sim,Regular,Não,Não se aplica porque a Escola não possui laboratório de ciências,Não se aplica porque a Escola não possui laboratório de ciências,Não se aplica porque a Escola não possui laboratório de ciências,Não,Não se aplica porque a Escola não possui refeitório,Sim,Não,Microondas;Armário;Utensílios De Cozinha;Processador/Multiprocessador;Torradeira;Liquidificador;Exaustor;Mesa De Preparo;Prateleiras,Sim,Sim,Sim,1 lanche por turno,Não,Sim,Por orientação do órgão responsável (drae ou secretaria de educação),Não,"Kit Aluno (Cadeira, Mesa E Materiais);Conjunto Professor (Mesa, Cadeira E Armário);Armários;Birôs;Mesas E Cadeiras De Refeitório;Lousa Para Sala De Aula;Estantes Para Livros / Armários De Armazenamento Para Material Pedagógico;Produtos Tecnológicos (Como Lousa Digital Ou Projetor);Móveis Para Secretaria Ou Direção",Não,Sim,Não,Busca Ativa Escolar;Busca Ativa Com O Conselho Tutelar;Contato Com Pais Ou Responsáveis;Visitas Domiciliares;Reuniões Com A Família,Sim,Sim,Não,Sim,"Sim, a Escola recebe menos livros que a quantidade de alunos",Não,Sim,16,Não,Professor de educação especializada/AEE;Psicólogo(a);Fonoaudiólogo(a);Terapeuta Ocupacional,Sim,Sim,Sim,Em médi 150,Não,0,Não se aplica porque a Escola não possui alunos que necessitam do transporte escolar especial,0,Sim,Não,Não se aplica porque não ha carência de professores na Escola,Sim,Sim,Sim,Sim,Sim,Sim,Sim,Sim,"Porte da escola (pequeno, médio, grande porte)",Sim,Sim,Sim,Bimestral,Sim,Sim,Sim,"Atividades esportivas (jogos, torneios, olimpíadas);feiras culturais;mostras literárias / feiras do livro;semana da cultura ou das artes;atividades ambientais (trilhas, hortas, campanhas);aulas de campo;feiras de profissões",3.1,Não sabemos,30%,Nao,Sim,Sim,Completo,Sim,Sim,Completo,Sim,Sim,Sim,Sim,Não,Não,Sim,Não,Sim,Sim,Não,PDDE Básico;PDDE Qualidade;PDDE Alimentação;PDDE Escola da Adolescência;Educação Conectada;PNAE;PAGUE,Sim,Não,Não,Não,Não,Não se aplic,Sim,Sim,Sim,Sim,Temos muitos trabalhos reconhecidos. Nossa escola ganhou o prêmio Paulo Freire de Educação em Brasília /2025.,"Permitir uma gestão participativa, acolhedora e que incentive toda equipe a uma educação com mais igualdade e equidade.",Sim,"Projeto que permita envolver a comunidade escolar nas atividades diárias da escola, permitindo ações educativas e aproximação da família e escola"
29/10/2025 15:43:44,ESCOLA MUNICIPAL DE 1 GRAU MAIOR PADRE LEÔNCIO,Rua 15 De Agosto,84 98103.7757,empadreleoncio@gmail.com,instagram - escola municipal padre leôncio,Weliton Arruda Da Costa,Severino Da Silva Lima,Municipal,1º ao 5º ano do Ensino Fundamental;6º ao 9º ano do Ensino Fundamental;EJA,Matutino;Vespertino;Noturno,Pedro Velho,Porte IV,210,"FUNDAEMNTAL 1 - 2 lieid, co lno do 1,2 e 3 no, o co lno do 4 e 5 no; FUNDAMEMNTAL 2 - 4 egle e EJA - 3 lieid, ol 9 .",4 salas,"Sim, apenas em parte dos turnos de funcionamento da Escola",Sim,Sim,Sim,2025,Sim,Sim,Sim,Todas as salas de aula com ventiladores,Monofásica,Não,Não,Não se aplica porque a Escola não possui quadra poliesportiva,Sim,Sim,Futebol masculino;futebol feminino;queimada;handball;futebol de areia;vôlei,Sim,"Espaços cedidos (campo de areia, campo de futebol, entre outros)",Sim,Sim,Sim,Não,Não se aplica porque a Escola não possui laboratório de informática,Não se aplica porque a Escola não possui laboratório de informática,Não se aplica porque a Escola não possui laboratório de informática,Não se aplica porque a Escola não possui laboratório de informática,Não,Não,Regular,Não,Não se aplica porque a Escola não possui laboratório de ciências,Não se aplica porque a Escola não possui laboratório de ciências,Não se aplica porque a Escola não possui laboratório de ciências,Não,Não se aplica porque a Escola não possui refeitório,Sim,Sim,Microondas;Processador/Multiprocessador;Torradeira;Batedeira;Exaustor;Mesa De Preparo;Prateleiras,Sim,Sim,Sim,1 lanche por turno,Sim,Sim,Controle supervisionado pela secretaria municipal de educação;verificação da qualidade e quantidade no momento do recebimento;existe local de armazenamento e registro das entradas e saídas,Sim,Mesas E Cadeiras De Refeitório,Sim,Sim,Sim,Busca Ativa Escolar;Contato Com Pais Ou Responsáveis;Visitas Domiciliares;Reuniões Com A Família;Monitoramento Pela Frequência Escolar,Não,Não,Sim,Sim,Não,Sim,Sim,11,Não,Professor de educação especializada/AEE,Sim,Sim,Não se aplica porque a Escola já possui transporte escolar,17,Sim,2,Todos os alunos nessa situação são atendidos,0,Sim,Sim,Temporários,Sim,Não,Sim,Sim,Não,Sim,Sim,Não,Não se aplica,Não,Não,Sim,Bimestral,Sim,Sim,Sim,"Festas escolares (dia das mães, páscoa, festa junina, natal);atividades esportivas (jogos, torneios, olimpíadas);gincanas culturais ou solidárias;apresentações artísticas (teatro, dança, música);semana da cultura ou das artes;atividades ambientais (trilhas, hortas, campanhas)",Em 2023 a escola não participou.,Não se aplica,"Ensino regular 6,8%; EJA 74%.",Sim,Sim,Sim,Completo,Sim,Sim,Completo,Não,Sim,Sim,Sim,Não,Sim,Sim,Não,Não,Sim,Sim,PDDE Básico;PDDE Qualidade;Educação Conectada,Sim,Sim,Não,Não se aplica,Não,Não se aplica,Sim,Sim,Não,Não,Não se aplica,"Assegurar a execução do projeto político-pedagógico (ppp), o cumprimento das finalidades da educação básica, a garantir uma gestão eficiente, democrática e comprometida com a qualidade",Não,Não se aplica
